source,time,title,content
Yahoo Finance,4 hours ago,Grayscale CEO on suing the SEC: 'This lawsuit isn't about bitcoin',"Effort to Reverse SEC Rejection of Bitcoin ETF Wins Broad Crypto, TradFi SupportCoinDesk
Sustainable Bitcoin Protocol Wants to Make Bitcoin a Climate-Positive AssetCoinDesk"
Forkast News,30 minutes ago,"Markets: Bitcoin, Ether fall along with rest of crypto top 10; Uniswap gains","Market Wrap: Crypto Prices Decline Slightly as Trading Volumes Continue to SagCoinDesk
First Mover Asia: Why Bridges Are So Vulnerable to Exploit; Bitcoin Falls Under $19KCoinDesk"
Business Insider,7 hours ago,US stocks snap 2-day win streak as investors digest surging bond yields ahead of more high-profile earnings,"Stocks fall as rise in yields overshadows earningsReuters Videos
GLOBAL MARKETS-U.S. stocks extend rally, Treasury yields dip after solid earnings, economic dataReuters"
Business Insider,13 hours ago,US stocks slip as rising bond yields and more inflation fears weigh on upbeat 3rd-quarter earnings,"Stocks fall as rise in yields overshadows earningsReuters Videos
GLOBAL MARKETS-U.S. stocks extend rally, Treasury yields dip after solid earnings, economic dataReuters"
Forkast News,16 hours ago,Bitcoin makes the Guinness World Records list as the first decentralized cryptocurrency,"Market Wrap: Crypto Prices Decline Slightly as Trading Volumes Continue to SagCoinDesk
First Mover Asia: Why Bridges Are So Vulnerable to Exploit; Bitcoin Falls Under $19KCoinDesk"
Forkast News,16 hours ago,"Markets: Bitcoin, Ether fall with top 10 cryptos, XRP slumps","Market Wrap: Crypto Prices Decline Slightly as Trading Volumes Continue to SagCoinDesk
First Mover Asia: Why Bridges Are So Vulnerable to Exploit; Bitcoin Falls Under $19KCoinDesk"
CoinDesk,21 hours ago,"Effort to Reverse SEC Rejection of Bitcoin ETF Wins Broad Crypto, TradFi Support","Sustainable Bitcoin Protocol Wants to Make Bitcoin a Climate-Positive AssetCoinDesk
Cryptoverse: Flurry of funds bet on bruised bitcoin's allureReuters"
Forkast News,yesterday,"Markets: Bitcoin, Ether fall as EU considers crackdown on energy-intensive crypto mining","Market Wrap: Crypto Prices Decline Slightly as Trading Volumes Continue to SagCoinDesk
First Mover Asia: Why Bridges Are So Vulnerable to Exploit; Bitcoin Falls Under $19KCoinDesk"
CoinDesk,yesterday,First Mover Americas: Bitcoin Holding Up at $19.5K Despite Bearish Conditions,"Market Wrap: Crypto Prices Decline Slightly as Trading Volumes Continue to SagCoinDesk
First Mover Asia: Why Bridges Are So Vulnerable to Exploit; Bitcoin Falls Under $19KCoinDesk"
Forkast News,2 days ago,"Markets: Bitcoin, Ether rise; Polygon, Solana lead gainers among the top 10 tokens","Is GBTC Stock A Good Buy As Bitcoin Slumps Amid Market Turmoil?Investor's Business Daily
Market Wrap: Crypto Prices Decline Slightly as Trading Volumes Continue to SagCoinDesk"
